clip,lang,prob,text
dataset/62. Ч.2. Галантерея/sound/0013.mp3,lv,0.322,"Kumatā kapron, neilon tārdar, valušdar dzandāta."
dataset/62. Ч.2. Галантерея/sound/0014.mp3,tr,0.440,Şarbatın
dataset/62. Ч.3. Обувь/sound/0001.mp3,ru,0.343,"Шардгонг, ах, Дарешвом, Ней? Зимни обуви. Жимагон."
dataset/62. Ч.3. Обувь/sound/0003.mp3,sk,0.211,"Môž skoje obvý. Noguj, Madge."
dataset/62. Ч.3. Обувь/sound/0005.mp3,de,0.228,Mancaue Toothlite.
dataset/62. Ч.3. Обувь/sound/0006.mp3,ru,0.230,Батинки. Сопоги.
dataset/62. Ч.4. Ткани/sound/0001.mp3,ar,0.328,ساوركمس دقوه
dataset/62. Ч.4. Ткани/sound/0002.mp3,ar,0.299,منقوه جيب فيشت قمس شردغون قبائن
dataset/62. Ч.4. Ткани/sound/0003.mp3,ar,0.362,أسقم أسد سشكوم تنظب خفيدا
dataset/63. Подарки/sound/0003.mp3,tr,0.230,Laplığın mamın lavarın iş tarafı gir.
dataset/63. Подарки/sound/0004.mp3,ar,0.350,ارغون
dataset/63. Подарки/sound/0005.mp3,lt,0.807,Asargas šilguoj magan.
dataset/63. Подарки/sound/0006.mp3,lt,0.520,reštim bie škara nalgojma gan
dataset/63. Подарки/sound/0008.mp3,kk,0.287,"Манды жінарғдір, ашландыр, лавар болғані"
dataset/63. Подарки/sound/0011.mp3,tr,0.596,"Kutdam kaşığı Aslı var, Şkolaza'u Aggagu."
dataset/63. Хозяйственные товары/sound/0001.mp3,ru,0.210,У АГОРАТЫ
dataset/63. Хозяйственные товары/sound/0002.mp3,hy,0.282,καو خازارادом ט fashion на tąuredmap دکانیитش
dataset/63. Хозяйственные товары/sound/0008.mp3,kk,0.442,"Манқауы цалым шагой жегалты, забуң хрқбалқаным."
dataset/63. Хозяйственные товары/sound/0013.mp3,kk,0.341,"Аварма мін, ахшаш уидыде, Карды, вилкай, ажгачіне кані, ахам, андонай."
dataset/64. Ч.1. Театр/sound/0001.mp3,uk,0.332,"Часть перве, тя!"
dataset/64. Ч.1. Театр/sound/0003.mp3,ru,0.353,ВАЗ РУСК
dataset/64. Ч.1. Театр/sound/0004.mp3,az,0.262,"Acdə, acı oqonun iron vır şagdra montiyatırmı."
dataset/64. Ч.1. Театр/sound/0007.mp3,ar,0.192,أبن إرون أرشق
dataset/64. Ч.1. Театр/sound/0008.mp3,uk,0.320,Куклато музикалом тятери.
dataset/64. Ч.1. Театр/sound/0009.mp3,fr,0.446,"C'est ça, on..."
dataset/64. Ч.1. Театр/sound/0010.mp3,ro,0.407,Manfand de Iște Iro în spectaclifene.
dataset/64. Ч.1. Театр/sound/0011.mp3,ro,0.326,Cine fost a aceea piersă.
dataset/64. Ч.1. Театр/sound/0012.mp3,ar,0.217,دجردامه فصدي سبيك تاق
dataset/64. Ч.1. Театр/sound/0013.mp3,hy,0.128,"Úlshag, framḣarāIGN teenagelichkeit sávrpiesate — Shbartā atiatr."
dataset/64. Ч.1. Театр/sound/0014.mp3,ro,0.670,Făști agraște de...
dataset/64. Ч.1. Театр/sound/0015.mp3,bg,0.437,чиве и ронхуждар драматур.
dataset/64. Ч.1. Театр/sound/0016.mp3,sq,0.294,Savar pijesate nuffaštea
dataset/64. Ч.10. Дирижер/sound/0001.mp3,tr,0.321,Arkadaşlarım
dataset/64. Ч.10. Дирижер/sound/0002.mp3,ru,0.211,хорен дирижор ЧИУ.
dataset/64. Ч.11. Режиссер/sound/0001.mp3,lt,0.635,Ti atrė spiktaklų
dataset/64. Ч.11. Режиссер/sound/0002.mp3,ja,0.357,キノイル
dataset/64. Ч.12. Искусство/sound/0001.mp3,de,0.777,"Man fandet Iran Adam Eyvadi mir bei schon geworfen. O was hier ist, Musique ist kuscht. Eyvadi muß hier um isch."
dataset/64. Ч.12. Искусство/sound/0003.mp3,de,0.985,"Fehl in meinen Köln, Fehl in Mamen Köln."
dataset/64. Ч.12. Искусство/sound/0004.mp3,ro,0.326,"Ragun Ivadă, expanată."
dataset/64. Ч.13. Архитектура/sound/0001.mp3,az,0.364,"Əsıx hazarı arki tikturı, sıkımatıg, amar əşşod u."
dataset/64. Ч.13. Архитектура/sound/0002.mp3,ar,0.114,آسخزر آرخيطيكتورة
dataset/64. Ч.13. Архитектура/sound/0003.mp3,tr,0.379,Majardama sağı. Majardama ne sağı?
dataset/64. Ч.14. Скульптура/sound/0001.mp3,sq,0.242,Manfand de bajon geoven i ronskulptarte wasmistima.
dataset/64. Ч.14. Скульптура/sound/0002.mp3,hy,0.232,қаманфالдрอәр қңыш үрң үрң ірікғон үрң сүлптертей қ ә та сүлптера қайу ас сүлптера ас сүлптера ҩғрң мҸс ғраға ға
dataset/64. Ч.15. Живопись/sound/0001.mp3,bg,0.382,"Каме шфейнан, балханан и рон в ганжите, уасмеште. Ту автор!"
dataset/64. Ч.15. Живопись/sound/0002.mp3,af,0.131,aasenneveu partrie te aftar chieo
dataset/64. Ч.15. Живопись/sound/0004.mp3,tr,0.913,"Kemşar'da, Iron Aftar'danlıktı."
dataset/64. Ч.15. Живопись/sound/0005.mp3,sk,0.287,Reprodukcit.
dataset/64. Ч.16. Художник/sound/0001.mp3,tr,0.274,Dajardama tıklar kasınıf gönceti kuştuyta savunuz.
dataset/64. Ч.16. Художник/sound/0002.mp3,hy,0.510,өр нөне жан өне жані өне жані.
dataset/64. Ч.17. Кино/sound/0001.mp3,yi,0.282,ארבון חושכינוןב אבדישנס.
dataset/64. Ч.17. Кино/sound/0002.mp3,el,0.137,βάσκει νό.
dataset/64. Ч.17. Кино/sound/0004.mp3,af,0.188,Kienoma de Kienoma wa Honon is biletader Raiston.
dataset/64. Ч.17. Кино/sound/0005.mp3,ps,0.317,Jairat Radha Dajardama Fasadish Kinonov Wa Jardama Fasadish Kinonov Akses Gon Manon
dataset/64. Ч.17. Кино/sound/0008.mp3,lt,0.577,Salkinetėt raiš uagoratų
dataset/64. Ч.17. Кино/sound/0009.mp3,ja,0.444,かんそうキノノ
dataset/64. Ч.17. Кино/sound/0010.mp3,ro,0.379,Camis am kineti atr.
dataset/64. Ч.18. Музей/sound/0001.mp3,bg,0.255,"Савър музейта, въм и шам горат."
dataset/64. Ч.18. Музей/sound/0002.mp3,ru,0.231,"Махмыш историон музей, басштажённый музей."
dataset/64. Ч.18. Музей/sound/0003.mp3,ru,0.566,"литературу на музей, это как оштая музей. Я, мы хочу!"
dataset/64. Ч.18. Музей/sound/0004.mp3,yi,0.198,"מה מער פנדו בשטאנן מוזיימא, בסעון"
dataset/64. Ч.18. Музей/sound/0006.mp3,fa,0.354,کسرانش خیتگتگاته اوشتای خزار مزی
dataset/64. Ч.18. Музей/sound/0010.mp3,ja,0.525,マナウイタスウ
dataset/64. Ч.18. Музей/sound/0011.mp3,ar,0.499,منعوي سخوين
dataset/64. Ч.19. Выставка/sound/0001.mp3,lt,0.275,Nertakai raštačių am savar raovdäštite iš.
dataset/64. Ч.19. Выставка/sound/0004.mp3,mn,0.233,"FANDE, FIENEN, DAWON, CHASARADON, PRAMISCHLINON, RAVDIST."
dataset/64. Ч.19. Выставка/sound/0005.mp3,ar,0.294,مشكوه نرقون عيواد راوضش فيتتاي فيتت
dataset/64. Ч.2. Опера/sound/0001.mp3,bg,0.285,"Шмахма националон опира, опирон театр, иш..."
dataset/64. Ч.2. Опера/sound/0002.mp3,pl,0.184,"Czejkowski opiera i je w gieni, a nie ginłam, a warto."
dataset/64. Ч.2. Опера/sound/0003.mp3,ru,0.751,А не егина.
dataset/64. Ч.2. Опера/sound/0005.mp3,lt,0.165,"Čižard, aniegini, Lienskii."
dataset/64. Ч.2. Опера/sound/0008.mp3,tr,0.906,Son son mutlulların
dataset/64. Ч.2. Опера/sound/0009.mp3,bg,0.205,"Райшум, опираме!"
dataset/64. Ч.20. Цирк/sound/0001.mp3,ro,0.575,"Manfande, zirc mă basau."
dataset/64. Ч.20. Цирк/sound/0002.mp3,ro,0.227,Siiși abonțirce.
dataset/64. Ч.20. Цирк/sound/0003.mp3,lt,0.314,somut cirkma.
dataset/64. Ч.20. Цирк/sound/0004.mp3,de,0.315,"Komm, ist es dir?"
dataset/64. Ч.20. Цирк/sound/0005.mp3,bg,0.584,и ронди гидтаза къж за ще.
dataset/64. Ч.20. Цирк/sound/0006.mp3,cy,0.231,i'r ond i gyd deim yn tân y pweld ište.
dataset/64. Ч.20. Цирк/sound/0007.mp3,tr,0.754,Dajarda mı fası dıştı?
dataset/64. Ч.20. Цирк/sound/0008.mp3,tr,0.478,Manen tanık fasıdıştı majardamı Yeron Cigitte.
dataset/64. Ч.21. Самодеятельность/sound/0001.mp3,hy,0.175,"Шמ�خ häuf십 fic weiterhin פرิشاد divided women,"
dataset/64. Ч.21. Самодеятельность/sound/0002.mp3,tr,0.557,Savrk ortam iş.
dataset/64. Ч.21. Самодеятельность/sound/0003.mp3,en,0.162,Dance with Vali!
dataset/64. Ч.21. Самодеятельность/sound/0005.mp3,pl,0.608,Machmo i szkawczyty żarzień dramon kord.
dataset/64. Ч.21. Самодеятельность/sound/0007.mp3,ar,0.531,شماخن وخيمة إشاركيستر فندر زغدك
dataset/64. Ч.21. Самодеятельность/sound/0009.mp3,ar,0.424,وخيك قبريشا ده راجع منق تيو
dataset/64. Ч.21. Самодеятельность/sound/0010.mp3,tr,0.435,Kadu'umuza niyi kaçtete ijar.
dataset/64. Ч.22. Билет/sound/0001.mp3,lt,0.265,"Raga saum bilet tă, veikannins"
dataset/64. Ч.22. Билет/sound/0005.mp3,uk,0.290,Сейаргу білет.
dataset/64. Ч.22. Билет/sound/0009.mp3,uk,0.290,Сейаргу білет.
dataset/64. Ч.3. Балет/sound/0001.mp3,he,0.353,בלטוום איש
dataset/64. Ч.3. Балет/sound/0002.mp3,de,0.447,Man von der Balletmobakaschen.
dataset/64. Ч.3. Балет/sound/0003.mp3,ru,0.294,"Чувы, усы, салист."
dataset/64. Ч.3. Балет/sound/0004.mp3,ro,0.882,Ce-we asa balirina.
dataset/64. Ч.3. Балет/sound/0005.mp3,ro,0.594,"Juletei partii, cicafă! Chărășu!"
dataset/64. Ч.3. Балет/sound/0007.mp3,ar,0.320,حرز حرز نقافه
dataset/64. Ч.4. Ансамбль/sound/0001.mp3,tr,0.343,Zardırtı amağım kavçıtı ansam bile iş
dataset/64. Ч.4. Ансамбль/sound/0002.mp3,kk,0.452,"Ман фанды 20-раған жеті емі, каф жеті аған санбыліма бакашін."
dataset/64. Ч.4. Ансамбль/sound/0003.mp3,tr,0.681,Majardamatınk Savihe ve Ansambül.
dataset/64. Ч.4. Ансамбль/sound/0004.mp3,sq,0.302,"Voi ensemble cancer tun ës feton măshkulje, kiivă."
dataset/64. Ч.6. Артист/sound/0001.mp3,pl,0.437,As artistem Jem Kagkameju.
dataset/64. Ч.6. Артист/sound/0002.mp3,lt,0.465,šaira grūlų čia kaži.
dataset/64. Ч.6. Артист/sound/0003.mp3,kk,0.235,Варашей Адамон артистом чивы. Далантливы. Курдет жін артист кау.
dataset/64. Ч.7. Акт/sound/0001.mp3,lt,0.166,Sao aktiš asipiesiai.
dataset/64. Ч.7. Акт/sound/0002.mp3,de,0.712,für Zug.
dataset/64. Ч.7. Акт/sound/0003.mp3,de,0.956,"Kösse, Aktversicht."
dataset/64. Ч.8. Антракт/sound/0001.mp3,lv,0.182,Sao minūtu uzanīš antrak.
dataset/64. Ч.8. Антракт/sound/0003.mp3,de,0.421,"Antrag beweise ich dann, wo fährt man?"
dataset/64. Ч.8. Антракт/sound/0004.mp3,tr,0.877,Don bana zıçtım.
dataset/64. Ч.8. Антракт/sound/0005.mp3,tr,0.957,vunugumu akışlıştım.
dataset/64. Ч.8. Антракт/sound/0006.mp3,kk,0.468,"Артіқ кәгзанғрің, ницахда, сон на бінеті өрсахшам."
dataset/64. Ч.9. Программа/sound/0001.mp3,hr,0.190,Savr program i žiran.
dataset/64. Ч.9. Программа/sound/0002.mp3,tr,0.664,"Kanser'den, Sürkan."
dataset/64. Ч.9. Программа/sound/0004.mp3,tr,0.295,"Programı momen, avır."
dataset/65. Ч.1. Образование/sound/0001.mp3,pl,0.901,"Cześć pierwę, obrazowanie."
dataset/65. Ч.1. Образование/sound/0003.mp3,fa,0.544,ساش آخرگون زیناتتم ایش
dataset/65. Ч.1. Образование/sound/0004.mp3,fa,0.678,ساش آخرگون زینادم اش
dataset/65. Ч.1. Образование/sound/0005.mp3,he,0.241,"עמית, שעבר שרמה גנד, אחר גנד, זינת, תמיש."
dataset/65. Ч.1. Образование/sound/0006.mp3,fa,0.191,آخرگون زینادم اش ککو اتی
dataset/65. Ч.1. Образование/sound/0007.mp3,lt,0.173,Savrškola kaštfadai.
dataset/65. Ч.1. Образование/sound/0008.mp3,lv,0.315,Savrškola kāšt fāsī.
dataset/65. Ч.1. Образование/sound/0009.mp3,ka,0.681,ubinontei waldar achr Gunzina疑Čology
dataset/65. Ч.10. Лекция/sound/0001.mp3,de,0.543,Saal legt sie um ich ab und...
dataset/65. Ч.10. Лекция/sound/0002.mp3,bg,0.372,Тири! Абон махме с арта!
dataset/65. Ч.10. Лекция/sound/0003.mp3,ru,0.501,СПОРЛЕКТИ
dataset/65. Ч.10. Лекция/sound/0008.mp3,lt,0.826,"Fiziki! Či omkas šeilekti ta iron, warššag, nemusag."
dataset/65. Ч.10. Лекция/sound/0009.mp3,lt,0.157,"Anglišag, Žagai, Jiron, Adamu."
dataset/65. Ч.10. Лекция/sound/0010.mp3,ru,0.258,История физикая.
dataset/65. Ч.11. Аудитория/sound/0001.mp3,de,0.881,Kösse Auditoreinamuseinisch legt sie.
dataset/65. Ч.11. Аудитория/sound/0002.mp3,he,0.232,"סל אכרגן האודיטורי איש אמף, שמחמא"
dataset/65. Ч.11. Аудитория/sound/0003.mp3,sk,0.334,"Saľ a dej mať bennáť zíš, a sa auditory."
dataset/65. Ч.11. Аудитория/sound/0004.mp3,pt,0.221,Aginas ao doutor.
dataset/65. Ч.11. Аудитория/sound/0006.mp3,lt,0.398,Somu dašam ywandašam auditorima nertakkanam umu uzani legcii.
dataset/65. Ч.12. Общежитие/sound/0001.mp3,tr,0.894,Düğü amzarını sarış.
dataset/65. Ч.12. Общежитие/sound/0002.mp3,tr,0.259,"Kasraniş, uyem zaran."
dataset/65. Ч.12. Общежитие/sound/0003.mp3,de,0.547,"Man macht von dir, wir im Saranfenen."
dataset/65. Ч.12. Общежитие/sound/0004.mp3,ro,0.387,Sa-l adeim aici s-ară în amzară-ne iu-u wată.
dataset/65. Ч.12. Общежитие/sound/0005.mp3,he,0.605,אבל צגן הוא החדק שניות אמסרן
dataset/65. Ч.13. Интернат/sound/0001.mp3,lt,0.533,kad aras arsidvo internet.
dataset/65. Ч.13. Интернат/sound/0005.mp3,la,0.597,"Uagorate, aua, rayone, res publikaje, bira internetta ish."
dataset/65. Ч.13. Интернат/sound/0007.mp3,ru,0.228,"Отдыха в интернете. Мой сын, моя дочь..."
dataset/65. Ч.13. Интернат/sound/0008.mp3,az,0.272,maşıvalladı mafard maçıcı ağırkanın s-internati.
dataset/65. Ч.14. Преподаватель/sound/0001.mp3,ar,0.364,أجدًا برشاج
dataset/65. Ч.14. Преподаватель/sound/0002.mp3,ru,0.308,Нема саг
dataset/65. Ч.14. Преподаватель/sound/0003.mp3,ar,0.521,آنغليشاق فزاج آخر جنق
dataset/65. Ч.14. Преподаватель/sound/0005.mp3,tr,0.419,"Dö, sağ var, predmeye döttü."
dataset/65. Ч.14. Преподаватель/sound/0006.mp3,de,0.300,Wuse. Man macht von defenen Skoleihe Wuse auch organisierte.
dataset/65. Ч.14. Преподаватель/sound/0010.mp3,pl,0.165,Francuzka wajezyka.
dataset/65. Ч.15. Школа/sound/0001.mp3,tr,0.401,"Kasır Aniş, Uyeşkola"
dataset/65. Ч.15. Школа/sound/0002.mp3,bg,0.270,"Касе вжагал ахурканут в ешколай, истори, географи, ама under предметта."
dataset/65. Ч.15. Школа/sound/0003.mp3,kk,0.535,"Касыглашей, фасштымаум ахорканғынс, фасаарайнаг, афжаг."
dataset/65. Ч.15. Школа/sound/0004.mp3,kk,0.152,"Савар фашарейнаң қавзғаң ахор канңыніз, уешколай? Яйзу чайу!"
dataset/65. Ч.15. Школа/sound/0005.mp3,ar,0.447,اش اخر كانن ماخ اخر كانن
dataset/65. Ч.15. Школа/sound/0006.mp3,ru,0.667,"Немцог, Англишог"
dataset/65. Ч.15. Школа/sound/0007.mp3,pl,0.755,"Francu, żaże w ża..."
dataset/65. Ч.15. Школа/sound/0010.mp3,uk,0.308,Вакоу і жароня школаїж.
dataset/65. Ч.16. Класс/sound/0001.mp3,az,0.448,Kəsik laşı aqorkanış?
dataset/65. Ч.16. Класс/sound/0002.mp3,kk,0.281,Қлаші сал ахоргані на дю үш.
dataset/65. Ч.16. Класс/sound/0003.mp3,yi,0.488,מה' נאח פנדו וגלשתפנן
"dataset/65. Ч.17. Программа, план/sound/0001.mp3",yi,0.304,"מנפנדה בעשון גבוהן, שקולהי אחר פרגרם היימה."
"dataset/65. Ч.17. Программа, план/sound/0007.mp3",lt,0.348,"fizikie. Ir on, uvršak, nemsa gvžadži, istoriji fizikai programai ma."
"dataset/65. Ч.17. Программа, план/sound/0009.mp3",ru,0.501,Класса. Школа и клава. Комла до он кустит.
"dataset/65. Ч.17. Программа, план/sound/0010.mp3",ru,0.213,планима.
"dataset/65. Ч.17. Программа, план/sound/0013.mp3",he,0.421,מרחמו
"dataset/65. Ч.17. Программа, план/sound/0014.mp3",pl,0.138,under programy i under plan.
dataset/65. Ч.18. Ученик/sound/0001.mp3,ru,0.162,Уезж колой охорганина к тащардыканикулты Кодар Витанс.
dataset/65. Ч.18. Ученик/sound/0002.mp3,ru,0.342,"Салщик у лазауом ахуркани, хорж..."
dataset/65. Ч.18. Ученик/sound/0003.mp3,ar,0.308,تنك خور
dataset/65. Ч.18. Ученик/sound/0004.mp3,pl,0.413,Restynbisz w żar.
dataset/65. Ч.18. Ученик/sound/0006.mp3,kk,0.229,"Асішкулазау, аф жара, хуркані."
dataset/65. Ч.18. Ученик/sound/0009.mp3,ar,0.462,ويك مراجد رأى أخر جنين أقوى
dataset/65. Ч.18. Ученик/sound/0010.mp3,ar,0.265,أجزي شارش تردان
dataset/65. Ч.19. Урок/sound/0001.mp3,ro,0.558,abonul am salurocis.
dataset/65. Ч.19. Урок/sound/0002.mp3,lt,0.222,Mokročima abad.
dataset/65. Ч.19. Урок/sound/0003.mp3,ru,0.390,Трудно!
dataset/65. Ч.19. Урок/sound/0004.mp3,en,0.363,
dataset/65. Ч.19. Урок/sound/0009.mp3,br,0.459,"Man, Marc Fande, Basa, oniron, Avjadje, Wurshag, Litila, Turai, Niem Saagavjadje, Faloie, Trimi, Physikei, Matimati, K. "
dataset/65. Ч.19. Урок/sound/0011.mp3,ar,0.184,دوركت شاخر كنتي
dataset/65. Ч.19. Урок/sound/0012.mp3,ar,0.644,وطبعوا لف آخر كن
dataset/65. Ч.2. Ученый/sound/0011.mp3,ar,0.379,ساور آخرادون قبخندم إش
dataset/65. Ч.2. Ученый/sound/0014.mp3,pl,0.592,"Filosowskich nauk. Aż dana fila logon, technikon, historion, filosofon nauka te kandidate, doktor. Technikumi."
dataset/65. Ч.2. Ученый/sound/0019.mp3,bg,0.445,Не. Ва института университете техникуме сална уката кандидата докторта и ш...
dataset/65. Ч.2. Ученый/sound/0021.mp3,ar,0.262,ويجن جنة أخر جنة أول
dataset/65. Ч.2. Ученый/sound/0022.mp3,ru,0.299,Жендгонтер Ахоргондом Чиу
dataset/65. Ч.20. Разговор с родителями/sound/0014.mp3,lt,0.571,Ubaši volat jų buldar školama saunus
dataset/65. Ч.20. Разговор с родителями/sound/0015.mp3,ka,0.328,"Škola mačin esau, aacham, aavdažezid, ʻaši təsāžezid, ʻevolatəom ʻiš."
dataset/65. Ч.20. Разговор с родителями/sound/0016.mp3,ru,0.320,"Валапу, watch it!"
dataset/65. Ч.20. Разговор с родителями/sound/0017.mp3,lv,0.220,Sālūna sāns školām.
dataset/65. Ч.20. Разговор с родителями/sound/0018.mp3,ru,0.840,Ваша дочь. Волопу. Вочер...
dataset/65. Ч.20. Разговор с родителями/sound/0019.mp3,ps,0.240,یقی افجردار شکولاي سونستتقنه والبپ
dataset/65. Ч.20. Разговор с родителями/sound/0020.mp3,ru,0.800,"Вот чешь, ехай уроктом. Ваш сын, ваша дочь"
dataset/65. Ч.20. Разговор с родителями/sound/0021.mp3,kk,0.490,"Волапу, отші жңа ахоркані, Аштей, аф жірдар ехій, Школа ма арбасу директерма, аанхашканінма."
dataset/65. Ч.20. Разговор с родителями/sound/0022.mp3,kk,0.243,"Валаппуйан, ва чужган, агар біріға щеңне харскаін канут хазар куштетал."
dataset/65. Ч.20. Разговор с родителями/sound/0023.mp3,ar,0.884,يا آخري فخجد رقان مطول
dataset/65. Ч.20. Разговор с родителями/sound/0024.mp3,lv,0.255,"Uofertu, atši, sā un navālsā un školāmā."
dataset/65. Ч.20. Разговор с родителями/sound/0025.mp3,kk,0.409,"өлапу, о чіз хо жа хоркан, аж зы ра жидан."
dataset/65. Ч.20. Разговор с родителями/sound/0026.mp3,fa,0.313,واتش جانانی زیناد کدو نمى فظ بخطاریش
"dataset/65. Ч.21. Экзамен, зачет, конкурс/sound/0001.mp3",lv,0.292,"Zadšot, kad fauzistud egzāmintalavard mach egzāmintalavard fauzistam iuni karon Sāvar bāra kanan reistai egzāmintu"
"dataset/65. Ч.21. Экзамен, зачет, конкурс/sound/0004.mp3",kk,0.253,"тңқор ждыті, аппат екзамінті дыр."
"dataset/65. Ч.21. Экзамен, зачет, конкурс/sound/0009.mp3",kk,0.253,"тңқор ждыті, аппат екзамінті дыр."
"dataset/65. Ч.21. Экзамен, зачет, конкурс/sound/0010.mp3",ar,0.164,ارفضم كنن اجزامين اجزامين تخشكي راتي راتي ويتخي
"dataset/65. Ч.21. Экзамен, зачет, конкурс/sound/0012.mp3",sq,0.422,"Štir konkursi, fi la logon, facultetma."
"dataset/65. Ч.21. Экзамен, зачет, конкурс/sound/0017.mp3",de,0.562,"Mach Institutma, Universitätma, Technikumma"
"dataset/65. Ч.21. Экзамен, зачет, конкурс/sound/0018.mp3",lt,0.542,Fakultietma štr. gytzil konkursiš.
dataset/65. Ч.22. Каникулы/sound/0001.mp3,ro,0.395,Caduamrea idei ziștă căniculță.
dataset/65. Ч.22. Каникулы/sound/0002.mp3,ro,0.461,Sa-șu ziște o canicul ta.
dataset/65. Ч.22. Каникулы/sound/0003.mp3,uk,0.867,Как ти думаешь провести конікуле? Кам!
dataset/65. Ч.22. Каникулы/sound/0004.mp3,sq,0.333,qud arvitës arvitëm makavëš de kanikultë.
dataset/65. Ч.22. Каникулы/sound/0005.mp3,lt,0.513,"Žkani kultraštai, že asauznan, maškuma, balgarima, dienģizma."
dataset/65. Ч.23. Детский сад/sound/0001.mp3,ru,0.310,"Шваллытый сахара, донуем ищ."
dataset/65. Ч.23. Детский сад/sound/0002.mp3,kk,0.178,Манфанды малаппуйе шивалаты сахарадо ма радтен.
dataset/65. Ч.23. Детский сад/sound/0004.mp3,kk,0.397,Сал Азіздый Ишенз Шивалыті Сахара Донма
dataset/65. Ч.23. Детский сад/sound/0005.mp3,he,0.341,משוולון יחי כדר
dataset/65. Ч.23. Детский сад/sound/0006.mp3,ar,0.204,شمخ تنجر دياجعي كشوت نشوف لطم
dataset/65. Ч.23. Детский сад/sound/0007.mp3,az,0.248,şəmah tən cərdəyə qəyi nə qasjut nəşvol attım.
dataset/65. Ч.24. Курсы/sound/0001.mp3,az,0.194,ÜLT vermərtə qind Santiago P making o زüla q邊 xələm ə yələ tərəkil girərəm. Nə qində teria nəti CC yerə Start It tə nə q
dataset/65. Ч.24. Курсы/sound/0006.mp3,de,0.857,Esch Archer können offiste.
dataset/65. Ч.24. Курсы/sound/0007.mp3,tr,0.478,"Kuşcita, Persana'nın kampültürtü, apiratırtı."
dataset/65. Ч.24. Курсы/sound/0008.mp3,tr,0.309,Satta ganan kursatı.
dataset/65. Ч.25. Библиотека/sound/0001.mp3,ru,0.714,Каждую обиблиотека.
dataset/65. Ч.25. Библиотека/sound/0002.mp3,ru,0.561,Салчин дише у библиотекей.
dataset/65. Ч.25. Библиотека/sound/0003.mp3,ru,0.248,"Ирон фищатый, у осмыштей, сытаясь, уобиблиотекая."
dataset/65. Ч.25. Библиотека/sound/0004.mp3,ar,0.383,قوري دوك قوري عم رضمة
dataset/65. Ч.25. Библиотека/sound/0005.mp3,pt,0.341,um esche negração.
dataset/65. Ч.25. Библиотека/sound/0006.mp3,lt,0.394,"Puskina, jevgeni anegin. Man kaue puskinačinig, wasmaš jevgeni anegin. Kostachie taugurava. Hei takatai, koštaičinig, ir"
dataset/65. Ч.26. Читальня/sound/0001.mp3,tr,0.384,Kaşandon kım i.
dataset/65. Ч.26. Читальня/sound/0002.mp3,yi,0.415,כששחת דווקושי קשן זו
dataset/65. Ч.26. Читальня/sound/0003.mp3,fr,0.390,Journal Mardouk.
dataset/65. Ч.26. Читальня/sound/0004.mp3,ro,0.241,"gezie-t reșcinade, jurnal, machdudje, asa a re farone. Păcif că m-am în avar."
dataset/65. Ч.4. Факультет/sound/0001.mp3,sq,0.781,Savar fakultiette iš uapeda gogon institute.
dataset/65. Ч.4. Факультет/sound/0002.mp3,de,0.731,Universität Ternikum.
dataset/65. Ч.4. Факультет/sound/0009.mp3,la,0.643,wa institute universitieta technikum geologon fakultet ish.
dataset/65. Ч.4. Факультет/sound/0012.mp3,la,0.593,Manfand d'Ebassaun fisichamatimatikum arzon geografion fakultetma.
dataset/65. Ч.4. Факультет/sound/0013.mp3,ar,0.459,أشعى حرقاً إيسطوريون فيلا لغون فكولتد
dataset/65. Ч.5. Кафедра/sound/0001.mp3,de,0.281,"Kösse Kaffee, Dröche, Kuschisch."
